{
  "executed_at": "2026-04-06T00:16:17Z",
  "plan_digest": "f8b1bb07f55eab18ebd6f0964e92c12a8adb1232f79e46e4243a67474cefcecf",
  "status": "dry-run",
  "steps": [
    {
      "argv": [
        "cargo",
        "mutants",
        "--in-diff",
        "H:/Code/Rust/proofrun/fixtures/demo-workspace/repo/.proofrun/diff.patch",
        "--package",
        "app"
      ],
      "duration_ms": 0,
      "exit_code": 0,
      "id": "mutation.diff[pkg=app]",
      "stderr_path": ".proofrun/logs/01-mutation.diff[pkg=app].stderr.log",
      "stdout_path": ".proofrun/logs/01-mutation.diff[pkg=app].stdout.log"
    },
    {
      "argv": [
        "cargo",
        "mutants",
        "--in-diff",
        "H:/Code/Rust/proofrun/fixtures/demo-workspace/repo/.proofrun/diff.patch",
        "--package",
        "core"
      ],
      "duration_ms": 0,
      "exit_code": 0,
      "id": "mutation.diff[pkg=core]",
      "stderr_path": ".proofrun/logs/02-mutation.diff[pkg=core].stderr.log",
      "stdout_path": ".proofrun/logs/02-mutation.diff[pkg=core].stdout.log"
    },
    {
      "argv": [
        "cargo",
        "nextest",
        "run",
        "--profile",
        "ci",
        "-E",
        "package(app)"
      ],
      "duration_ms": 0,
      "exit_code": 0,
      "id": "tests.pkg[pkg=app]",
      "stderr_path": ".proofrun/logs/03-tests.pkg[pkg=app].stderr.log",
      "stdout_path": ".proofrun/logs/03-tests.pkg[pkg=app].stdout.log"
    },
    {
      "argv": [
        "cargo",
        "nextest",
        "run",
        "--profile",
        "ci",
        "-E",
        "package(core)"
      ],
      "duration_ms": 0,
      "exit_code": 0,
      "id": "tests.pkg[pkg=core]",
      "stderr_path": ".proofrun/logs/04-tests.pkg[pkg=core].stderr.log",
      "stdout_path": ".proofrun/logs/04-tests.pkg[pkg=core].stdout.log"
    },
    {
      "argv": [
        "cargo",
        "doc",
        "--workspace",
        "--no-deps"
      ],
      "duration_ms": 0,
      "exit_code": 0,
      "id": "workspace.docs",
      "stderr_path": ".proofrun/logs/05-workspace.docs.stderr.log",
      "stdout_path": ".proofrun/logs/05-workspace.docs.stdout.log"
    },
    {
      "argv": [
        "cargo",
        "test",
        "--workspace",
        "--quiet"
      ],
      "duration_ms": 0,
      "exit_code": 0,
      "id": "workspace.smoke",
      "stderr_path": ".proofrun/logs/06-workspace.smoke.stderr.log",
      "stdout_path": ".proofrun/logs/06-workspace.smoke.stdout.log"
    }
  ],
  "version": "0.1.0-ref"
}
