{
  "executed_at": "2026-04-06T00:16:17Z",
  "plan_digest": "871bbf5dc88f5afe6166185ef8ae198b431caa08da598dde70be926719b778d6",
  "status": "dry-run",
  "steps": [
    {
      "argv": [
        "cargo",
        "test",
        "--workspace",
        "--quiet"
      ],
      "duration_ms": 0,
      "exit_code": 0,
      "id": "workspace.smoke",
      "stderr_path": ".proofrun/logs/01-workspace.smoke.stderr.log",
      "stdout_path": ".proofrun/logs/01-workspace.smoke.stdout.log"
    }
  ],
  "version": "0.1.0-ref"
}
